### ISSUE TITLE
`PostResult` URL not being updated

### ISSUE THREAD

**Issue by madduck** [obbimi/Squore#41]
I configured my PostResult URL like so:

![image](https://github.com/user-attachments/assets/31c6836c-3b05-4c83-b049-bcba6ee654ad)

When a match ends, I get this dialog box:

![image](https://github.com/user-attachments/assets/551a0f28-6e8b-4f4d-9963-77d17813b458)

If I hit "OK", nothing happens. Looking on the wire, I see Squore trying to access port 80, not port 8080:

```
13:30:12.722286 IP 192.168.122.246.44206 > 192.168.122.33.80: Flags [S], seq 493631713, win 64240, options [mss 1460,sackOK,TS val 56304577 ecr 0,nop,wscale 7], length 0
13:30:13.744744 IP 192.168.122.246.44206 > 192.168.122.33.80: Flags [S], seq 493631713, win 64240, options [mss 1460,sackOK,TS val 56305599 ecr 0,nop,wscale 7], length 0
13:30:15.792775 IP 192.168.122.246.44206 > 192.168.122.33.80: Flags [S], seq 493631713, win 64240, options [mss 1460,sackOK,TS val 56307647 ecr 0,nop,wscale 7], length 0
```

Maybe of relevance:

I once included `"PostResult": "http://192.168.122.33/result"` in the match feed JSON, i.e. without the port. I have since corrected this, but it might be stuck somehow. I have reset the configuration, after exporting it, then imported it. I have cleared the Android app cache.

Only a tablet reboot would finally get rid of this orphan ghost URL.

**Comment by madduck** [comment]
I think this issue is not at all related to the port, but rather to some zombie URL that won't die. I've changed my dev setup a couple of days ago, and now there's a new IP address. While match and player loading works fine from the new URL (using IP addresses, not DNS), Squote stoichally still tries to `POST` results to the old IP. I've cleared cache, rebooted, nothing helped.

Curiously, it *just* worked. It tried posting to the old IP forever, and then suddently it switched to the new IP while trying:

```
10:23:23.644084 IP 192.168.122.246.58356 > 192.168.122.33.8080: Flags [S], seq 4257045724, win 64240, options [mss 1460,sackOK,TS val 3299838244 ecr 0,nop,wscale 7], length 0
10:23:40.072336 IP 192.168.122.246.56332 > 192.168.39.32.8080: Flags [.], seq 393:1841, ack 9769, win 501, options [nop,nop,TS val 3371764188 ecr 219458230], length 1448: HTTP: POST /result HTTP/1.1
```

**Comment by madduck** [comment]
I can reproduce this still. When I submit results, the app spins and tries to send the results to the old IP:

![image](https://github.com/user-attachments/assets/207fc62e-5992-44d1-acdf-65cb2642b03e)

It tries this for 5 minutes and 20 seconds (320s?) and then suddenly succeeds submitting the results to the new IP.

**Comment by obbimi** [comment]
Is the old URL still visible somewhere if you follow 
> Settings > Internet > Feeds > Selectable Feed URLs
?

**Comment by madduck** [comment]
No, I cannot find it anywhere...

**Comment by madduck** [comment]
I have now:

1. Removed `PostResult` from the `/feed/feeds` list;
2. Added `PostResult` to the `matches` feed
3. Quit the app
4. Cleared the cache
5. Rebooted the device

And it's still trying the old IP. This is one of the weirdest bugs I've ever seen I think.

**Comment by obbimi** [comment]
Closing ... not easily reproducible....
